{
    "input_json": {
        "api_key": "1234567890abcdefghijkl",
        "input_type": "VIDEO",
        "input_bucket": "ct-my-bucket-in",
        "input_file": "/input1/test1.mp4",
        "job_label": "test1 transcode",
        "outputs": [
            {
		"output_type": "THUMB",
		"mode": "snapshot",
		"output_bucket": "ct-my-bucket-out",
		"output_file": "/output1/thumbs/test1_thumb.png",
		"s3_rrs": true,
		"size": "160x120",
		"snapshot_sec": 5
	    }
        ]
    },
    "input_asset_type": "VIDEO",
    "input_asset_info": {
        "duration": 25.05,
        "vcodec": "h264",
        "color": "yuv420p",
        "size": "480x360",
        "vbitrate": "640 kb/s",
        "fps": "30 fps",
        "ratio": "1.3",
        "acodec": "aac",
        "freq": "44100 Hz",
        "mode": "mono",
        "abitrate": "72 kb/s"
    },
    "output": {
        "output_type": "THUMB",
	"mode": "snapshot",
	"output_bucket": "ct-my-bucket-out",
	"output_file": "/output1/thumbs/test1_thumb.png",
	"s3_rrs": true,
	"size": "160x120",
	"snapshot_sec": 5
    }
}
